{
  "$schema": "https://json-schema.org/draft/2020-12/schema",
  "$id": "https://open-typing-texts.local/schemas/ott-repo.schema.json",
  "title": "OTT Repo v1 Manifest",
  "description": "Control-plane manifest for subscribing to decentralized text sources. Independently versioned from OTT Core v1.",
  "$comment": "Canonical manifest bytes (normative): the manifest with the 'trust' key removed, serialized as UTF-8 JSON, keys sorted bytewise, no whitespace between tokens (separators=(\",\", \":\")), no trailing commas. Signature: ed25519:<128 hex> or bare 128 hex. Pubkey: ed25519:<64 hex> or bare 64 hex. minisign is not supported.",
  "type": "object",
  "required": ["protocol", "version", "type", "repo_id", "name", "mirrors", "sources"],
  "additionalProperties": true,
  "properties": {
    "protocol": { "const": "ott-repo" },
    "version": {
      "type": "string",
      "pattern": "^[0-9]+\\.[0-9]+(\\.[0-9]+)?(-[a-zA-Z0-9]+)?$"
    },
    "type": { "enum": ["repository", "directory"] },
    "repo_id": {
      "type": "string",
      "minLength": 1,
      "description": "Stable identity: reverse-domain (org.example.texts), key fingerprint (key:ed25519:<24-hex>), or 'local'."
    },
    "name": { "type": "string", "minLength": 1 },
    "description": { "type": "string" },
    "maintainer": {
      "type": "object",
      "additionalProperties": false,
      "properties": {
        "name": { "type": "string" },
        "homepage": { "type": "string", "format": "uri" }
      }
    },
    "license": { "type": "string" },
    "updated_at": { "type": "string", "format": "date-time" },
    "mirrors": {
      "type": "array",
      "minItems": 1,
      "items": {
        "type": "object",
        "required": ["url", "priority"],
        "additionalProperties": false,
        "properties": {
          "url": { "type": "string", "format": "uri" },
          "priority": { "type": "integer", "minimum": 1 }
        }
      }
    },
    "trust": {
      "type": "object",
      "additionalProperties": false,
      "properties": {
        "signature": { "type": "string", "description": "ed25519 signature (ed25519:<128 hex> or bare 128 hex) over canonical manifest bytes (manifest minus trust key, UTF-8, sort_keys, no whitespace)." },
        "pubkey": { "type": "string", "description": "ed25519 public key (ed25519:<64 hex> or bare 64 hex); TOFU-pinned by clients." },
        "required": {
          "type": "boolean",
          "default": false,
          "description": "Reserved for curated directories. General repos SHOULD keep false."
        }
      }
    },
    "requires": {
      "type": "object",
      "additionalProperties": false,
      "properties": {
        "ott_core": {
          "type": "string",
          "description": "Semver range the repo needs from OTT Core (e.g. '>=1.0')."
        },
        "client_features": {
          "type": "array",
          "items": { "type": "string" },
          "description": "Optional Profile features the client must support."
        }
      }
    },
    "sources": {
      "type": "array",
      "items": {
        "type": "object",
        "required": ["type"],
        "properties": {
          "type": {
            "enum": ["ott-instance", "ott-rule", "ott-bridge", "ott-script", "repository-ref"]
          }
        },
        "allOf": [
          {
            "if": { "properties": { "type": { "const": "ott-instance" } } },
            "then": {
              "required": ["authority", "endpoints"],
              "additionalProperties": false,
              "properties": {
                "type": { "const": "ott-instance" },
                "authority": { "type": "string", "minLength": 1 },
                "label": { "type": "string" },
                "endpoints": {
                  "type": "array",
                  "minItems": 1,
                  "items": {
                    "type": "object",
                    "required": ["url"],
                    "additionalProperties": false,
                    "properties": {
                      "url": { "type": "string", "format": "uri" },
                      "profile": { "enum": ["static", "service"], "default": "static" },
                      "priority": { "type": "integer", "minimum": 1 }
                    }
                  }
                },
                "tags": { "type": "array", "items": { "type": "string" } },
                "default_enabled": { "type": "boolean", "default": true }
              }
            }
          },
          {
            "if": { "properties": { "type": { "const": "ott-rule" } } },
            "then": {
              "required": ["rule_id", "rule"],
              "additionalProperties": false,
              "properties": {
                "type": { "const": "ott-rule" },
                "rule_id": { "type": "string", "minLength": 1 },
                "label": { "type": "string" },
                "rule": {
                  "type": "object",
                  "required": ["request", "extract"],
                  "additionalProperties": false,
                  "properties": {
                    "kind": { "type": "string", "default": "json-api" },
                    "request": {
                      "type": "object",
                      "required": ["url"],
                      "additionalProperties": false,
                      "properties": {
                        "url": { "type": "string", "format": "uri", "pattern": "^https?://", "description": "Public http(s) target only; file:/loopback/private/reserved ranges are rejected by the interpreter." },
                        "method": { "enum": ["GET", "POST", "PUT", "PATCH", "DELETE"], "default": "GET" },
                        "headers": {
                          "type": "object",
                          "additionalProperties": { "type": "string" }
                        },
                        "body": {
                          "description": "Literal request body, or null when constructed via 'steps'. str passes through, dict/list are JSON-serialized, int/bool are stringified; float and other types are rejected. When 'steps' is present and body is null, the first step is not prepended with the body.",
                          "oneOf": [
                            { "type": ["string", "integer", "boolean", "null"] },
                            { "type": "array" },
                            { "type": "object" }
                          ]
                        }
                      }
                    },
                    "extract": {
                      "type": "object",
                      "description": "JSON path, named regex group, or CSS selector per field."
                    },
                    "transform": {
                      "type": "array",
                      "items": { "enum": ["trim", "replace", "truncate"] },
                      "description": "L1 fixed pipeline; MUST NOT coexist with 'steps'."
                    },
                    "steps": {
                      "type": "array",
                      "minItems": 1,
                      "maxItems": 8,
                      "description": "L1.5 sequential DSL pipeline; each step output becomes the next step's first arg unless body is null. Max 8 steps (MAX_STEPS); engine enforces MAX_CALLS=1000 and MAX_DEPTH=32 at runtime.",
                      "items": {
                        "type": "object",
                        "required": ["fn"],
                        "additionalProperties": false,
                        "properties": {
                          "fn": {
                            "enum": [
                              "str", "int", "bool", "len", "if", "eq", "not",
                              "add", "sub", "mul", "div", "mod",
                              "bit_and", "bit_or", "bit_xor", "bit_shift",
                              "now_unix", "now_iso", "random_int",
                              "regex_extract", "regex_replace",
                              "base64_encode", "base64_decode",
                              "url_encode", "url_decode",
                              "hex_encode", "hex_decode",
                              "utf8_encode", "utf8_decode",
                              "json_encode", "json_decode",
                              "dict_get", "list_get", "list_len", "list_join",
                              "url_join", "url_query", "concat",
                              "md5", "sha1", "sha256", "hmac_sha256",
                              "aes_cbc_encrypt", "aes_cbc_decrypt", "xor"
                            ],
                            "description": "Whitelisted pure primitive; unknown fns are rejected."
                          },
                          "args": {
                            "type": "array",
                            "maxItems": 32,
                            "description": "Literal values, nested expression trees, or {\"ref\": \"body\"} to reference the request.body literal.",
                            "items": {
                              "oneOf": [
                                { "type": ["string", "integer", "boolean", "null"] },
                                { "type": "array" },
                                { "type": "object", "not": { "required": ["ref"] } },
                                {
                                  "type": "object",
                                  "required": ["ref"],
                                  "additionalProperties": false,
                                  "properties": { "ref": { "const": "body" } }
                                }
                              ]
                            }
                          }
                        }
                      }
                    },
                    "permissions": {
                      "type": "object",
                      "additionalProperties": false,
                      "properties": {
                        "network": {
                          "type": "array",
                          "minItems": 1,
                          "items": { "type": "string", "minLength": 1 },
                          "description": "Domain whitelist (subdomains match); enforced at declaration time - a URL outside the whitelist rejects the whole rule. When absent, the baseline validate_url policy applies."
                        }
                      }
                    },
                    "rights": {
                      "type": "object",
                      "additionalProperties": false,
                      "properties": {
                        "min_api_level": { "type": "integer", "minimum": 1, "description": "Client API level below this marks the rule incompatible and skips it." }
                      }
                    },
                    "schedule": {
                      "type": "object",
                      "properties": {
                        "mode": { "enum": ["manual", "hourly", "daily"] },
                        "cache_ttl_seconds": { "type": "integer", "minimum": 0 }
                      }
                    },
                    "pagination": {
                      "type": "object",
                      "properties": {
                        "param": { "type": "string" },
                        "start": { "type": "integer" },
                        "step": { "type": "integer" },
                        "max_pages": { "type": "integer", "minimum": 1 }
                      }
                    }
                  },
                  "allOf": [
                    {
                      "if": { "required": ["steps"] },
                      "then": { "not": { "required": ["transform"] } }
                    }
                  ]
                },
                "tags": { "type": "array", "items": { "type": "string" } }
              }
            }
          },
          {
            "if": { "properties": { "type": { "const": "ott-bridge" } } },
            "then": {
              "required": ["bridge_kind", "endpoint"],
              "additionalProperties": false,
              "properties": {
                "type": { "const": "ott-bridge" },
                "bridge_kind": { "type": "string", "minLength": 1 },
                "endpoint": { "type": "string", "format": "uri" },
                "label": { "type": "string" },
                "requires_credentials": { "type": "boolean", "default": false },
                "tags": { "type": "array", "items": { "type": "string" } }
              }
            }
          },
          {
            "if": { "properties": { "type": { "const": "ott-script" } } },
            "then": {
              "required": ["url"],
              "additionalProperties": false,
              "properties": {
                "type": { "const": "ott-script" },
                "url": { "type": "string", "format": "uri", "pattern": "^https?://", "description": "Public http(s) URL of the script payload (.py). L3 executes only when the repo trust_state is verified (signature gate)." },
                "label": { "type": "string" },
                "default_enabled": { "type": "boolean", "default": true },
                "checksum": { "type": "string", "pattern": "^sha256:[0-9a-fA-F]{64}$", "description": "sha256:<64 hex> of the payload; verified before execution." },
                "permissions": {
                  "type": "object",
                  "additionalProperties": false,
                  "properties": {
                    "network": { "type": "array", "items": { "type": "string" }, "description": "Hostname allowlist (subdomain match); enforced at runtime when declared." },
                    "secrets": { "type": "array", "items": { "type": "string" }, "description": "Keyring credential names the script may read; never carried in the manifest." }
                  }
                },
                "rights": {
                  "type": "object",
                  "additionalProperties": false,
                  "properties": {
                    "min_api_level": { "type": "integer", "minimum": 1, "description": "Client API level required; lower clients skip this source as incompatible." }
                  }
                },
                "tags": { "type": "array", "items": { "type": "string" } }
              }
            }
          },
          {
            "if": { "properties": { "type": { "const": "repository-ref" } } },
            "then": {
              "required": ["url"],
              "additionalProperties": false,
              "properties": {
                "type": { "const": "repository-ref" },
                "url": { "type": "string", "format": "uri" },
                "label": { "type": "string" },
                "tags": { "type": "array", "items": { "type": "string" } }
              }
            }
          }
        ]
      }
    }
  },
  "allOf": [
    {
      "if": { "properties": { "type": { "const": "directory" } } },
      "then": {
        "properties": {
          "sources": {
            "type": "array",
            "items": {
              "required": ["type"],
              "properties": {
                "type": { "const": "repository-ref" }
              }
            }
          }
        }
      }
    }
  ]
}
