{
  "protocol": "ott-repo",
  "version": "1.0",
  "type": "directory",
  "repo_id": "dir.example.org",
  "name": "Community Repo Directory",
  "description": "A curated list of community-maintained repos.",
  "maintainer": { "name": "community-curator" },
  "license": "CC-BY-4.0",
  "updated_at": "2026-08-01T00:00:00+08:00",
  "mirrors": [
    { "url": "https://dir.example.org/ott-repo.json", "priority": 1 }
  ],
  "sources": [
    {
      "type": "repository-ref",
      "url": "https://texts.example.org/ott-repo.json",
      "label": "Example Mixed Source Library",
      "tags": ["chinese"]
    },
    {
      "type": "repository-ref",
      "url": "https://other.example.net/ott-repo.json",
      "label": "Another Library",
      "tags": ["english"]
    }
  ]
}
